{"recordType":"nutrition-intake-candidate","schemaVersion":"1.0.0","candidateId":"candidate-apple-001","origin":{"kind":"image"},"foodCandidates":[{"label":"synthetic apple"}],"mediaRetention":{"containsRawPhoto":false,"containsReceiptImage":false,"containsRawAudio":false,"containsAppearanceEmbedding":false,"containsRawWearablePayload":false}}
